G2500229,2025-08-04,Internship,Full-time,Guotai Junan Investments (Hong Kong) Limited,Banking / Financial Services,China,10-50 employees,"Intern, Operations & Settlement",1,Banking / Finance Executive,"Responsibilities Undertake operational activities across various FICC & E products in accurate and timely manner, including but not limited to trade confirmations, settlements, PnL calculation, money transfer, etc.
Monitor overall positions and account details, assist supervisor in overall liquidity management；
Conduct daily reports based on risk management and finance department inquiries;
Prepare daily reconciliation reports to Supervisor
Help to liaise with front office, brokers, IT and/or custodians to resolve trade and settlement issues
Daily trade documents filing
Assist in system modification, data upload, and UAT testing
Support the team in other relevant areas and perform ad hoc duties as assigned.
  Requirements Degree holder or above in Finance, Economics, Accounting or Business related;
Great attention into details, strong sense of responsibility;
Excellent command of written and spoken English and Chinese, fluency in mandarin is a plus；
High computer literacy with strong excel spreadsheet skills.
  (Data collected will be kept strictly confidential and used for recruitment purpose only.)",HKD 45 per Hour,Hong Kong,Fully on-site work,"Accounting & Finance
Business Administration
Economics","Bachelor, Master",7.5,5,2025-08-31,1,hrfh@gtht.com,"CV, Cover Letter",,,,,,國泰君安證券投資(香港)有限公司
G2500221,2025-08-04,Internship,Part-time,Oxbridge Economics Limited,Management Consulting,Hong Kong,1-10 employees,Sales & Marketing Intern,1,Advertising / Marketing / Marketing Research,"Oxbridge Economics is seeking a Marketing Associate who is creative, organized, and passionate about bridging strategic communication with compelling design. You will support our business development and client engagement efforts by producing high-quality marketing materials, coordinating events, and serving as a key liaison with potential clients and partners.
  Key Responsibilities Client Communication: Engage with prospective clients, partners, and stakeholders through email, meetings, and events to promote Oxbridge’s offerings.
Marketing Content Creation:Design and prepare decks, posters, email campaigns, social media posts, and promotional videos to support product launches and brand visibility.
Event Coordination:Organize and execute marketing events, webinars, and campaigns, including logistics, materials, and follow-up communication.
  Qualifications    Strong communication skills, both written and verbal, in English.
 Proven ability to create polished marketing materials with tools like Canva, PowerPoint, or Adobe Suite.
 An eye for design with a clear understanding of branding and business tone.
 Detail-oriented, reliable, and self-motivated with a passion for marketing and storytelling.
 Experience in social media, email marketing platforms, or video production is a plus.
  Preferred Traits    A sense of ownership and responsibility in managing tasks independently.
 Creative thinker with a strong sense of aesthetics and strategic messaging.
 Prior experience in B2B marketing or working with startups is a bonus.",HKD 7300 per Month,Hong Kong,Hybrid work,"All disciplines
Marketing
Media and Cultural Studies
Medical Sciences / Engineering","Bachelor, Master",24,3,2025-10-08,1,careers@oxbridge-econ.com,Transcript(s),,Tiffany (HR),,,,
